{
  "id": "site-layout",
  "rev": "3-c1d8c40931a93ceb401ca08af5ef5ed7",
  "name": "siteLayout",
  "classification": "layout",
  "prerender": false,
  "tags": [
    "sites-next",
    "mode:head",
    "mode:body"
  ],
  "thumbnail": {
    "path": "/dxauth/layoutThumbs/site-layout.jpg"
  },
  "template": "/sites/templates/site-layout.hbs",
  "templateType": "handlebars",
  "urlTemplate": "{templateLocation}/sites/site-layout/{id}.html"
}