{
  "id": "page-style-contribution-layout",
  "rev": "3-fb9ff71bf874f69e964bdf9ae8c46da4",
  "name": "pageStyleContributionLayout",
  "classification": "layout",
  "prerender": false,
  "tags": [
    "sites-next",
    "mode:head",
    "mode:body"
  ],
  "thumbnail": {
    "path": "/dxauth/layoutThumbs/page-contributions-layout.jpg",
    "url": "/authoring/v1/resources/a9b7575381cd03962dbe81e4116c8663_63b3f57e91735eaa985f3ace1e44f38a"
  },
  "template": "/sites/templates/page-style-contribution-layout.hbs",
  "templateType": "handlebars",
  "urlTemplate": "{templateLocation}/sites/page-styke-contribution/{id}.html"
}