{
  "name": "siteLayout",
  "id": "sites-layout",
  "classification": "layout",
  "prerender": false,
  "tags": [
    "sites-next",
    "mode:head",
    "mode:body"
  ],
  "template": "/dxdam/templates/sites-layout.hbs",
  "templateType": "handlebars",
  "thumbnail": {
    "path": "/dxauth/layoutThumbs/sites-layout.jpg"
  },
  "urlTemplate": "{templateLocation}/sites/sites-layout/{id}.html",
  "rev": "0-58fa3a3a-6510-4de0-80a9-49bf679a3b5d"
}