{
  "id": "page-markup-contribution-layout",
  "rev": "3-0d2b7daa7c6cfeacdd9daac80bd97b09",
  "name": "pageMarkupContributionLayout",
  "classification": "layout",
  "prerender": false,
  "tags": [
    "sites-next",
    "mode:head",
    "mode:body"
  ],
  "thumbnail": {
    "path": "/dxauth/layoutThumbs/page-contributions-layout.jpg",
    "url": "/authoring/v1/resources/a9b7575381cd03962dbe81e4116c8663_63b3f57e91735eaa985f3ace1e44f38a"
  },
  "template": "/sites/templates/page-markup-contribution-layout.hbs",
  "templateType": "handlebars",
  "urlTemplate": "{templateLocation}/sites/page-markup-contribution/{id}.html"
}