{
  "id": "all-types-page-hero-2-blocks",
  "rev": "1-d4df691f79b900e2e0a6ffea893dbadc",
  "name": "Three blocks",
  "classification": "layout",
  "prerender": false,
  "thumbnail": {
    "path": "/layouts/thumbnails/standard-page-hero-2-blocks_220.svg"
  },
  "template": "all-types-page-hero-2-blocks",
  "templateType": "angular"
}