{
  "name": "pageEmbedContributionLayout",
  "id": "page-embed-contribution-layout",
  "classification": "layout",
  "prerender": false,
  "tags": [
    "sites-next",
    "mode:head",
    "mode:body"
  ],
  "template": "/dxdam/templates/page-embed-contribution-layout.hbs",
  "templateType": "handlebars",
  "thumbnail": {
    "path": "/dxauth/layoutThumbs/page-contributions-layout.jpg",
    "url": "/authoring/v1/resources/a9b7575381cd03962dbe81e4116c8663_63b3f57e91735eaa985f3ace1e44f38a"
  },
  "urlTemplate": "{templateLocation}/sites/page-embed-contribution/{id}.html",
  "rev": "0-5c696d2e-412a-4783-be51-6d74bec90331"
}