{
  "id": "7c5c6e04-6777-4757-a703-7644d4d81c25",
  "rev": "1-39e983fb369afd523629ddf07106b9d2",
  "name": "HTML Email Layout",
  "classification": "layout",
  "prerender": false,
  "template": "/email/html-email-layout.hbs",
  "templateType": "handlebars",
  "urlTemplate": "{templateLocation}/html-email-layout/{id}.html"
}